layer_id,lat,lon,name,plant_code,county,technology,capacity,sector,inr,fuel,mw,zone,poi,entity,funnel_stage,group,under_construction,commissioned,capacity_mw,operator,voltage,osm_id,depth_ft,use,aquifer,project,manu,model,cap_kw,year
tceq_gas_turbines,30.891901,-102.883662,Poolside LF Phase 2 DC Ops LLC (183235),183235,Pecos,Gas turbine SC,,,,natural_gas,332.28,,,Poolside LF Phase 2 DC Ops LLC,,,,2026-03-12,332.28,Poolside LF Phase 2 DC Ops LLC,,,,,,,GE,TM2500 GEN 8 &  TM2500 PLUS,,2026
tceq_gas_turbines,31.643189,-101.768241,"Accelerated Mobile Power, LLC (180294)",180294,Reagan,Gas turbine SC,,,,natural_gas,60,,,"Accelerated Mobile Power, LLC",,,,2025-10-30,60,"Accelerated Mobile Power, LLC",,,,,,,Solar Turbines,Solar Titan 130-23001S Radial,,2025
tceq_gas_turbines,31.589052,-102.886190,"Luminant Generation Company, LLC (178462)",178462,Ward,Gas turbine SC,,,,natural_gas,833,,,"Luminant Generation Company, LLC",,,,2025-09-24,833,"Luminant Generation Company, LLC",,,,,,,GE,GE H-Class 7HA.03,,2024
tceq_gas_turbines,31.425414,-103.495289,Featherwood Capital LLC (182541),182541,Reeves,Gas turbine SC,,,,natural_gas,931,,,Featherwood Capital LLC,,,,2026-01-08,931,Featherwood Capital LLC,,,,,,,Siemens,Siemens SGT-800,,2025
tceq_gas_turbines,31.632915,-101.839850,"Accelerated Mobile Power, LLC (179297)",179297,Upton,Gas turbine SC,,,,natural_gas,60,,,"Accelerated Mobile Power, LLC",,,,2025-08-12,60,"Accelerated Mobile Power, LLC",,,,,,,Solar Turbines,Solar Titan 130-23001S Radial,,2025
tceq_gas_turbines,31.461469,-103.394632,"CPV Basic Ranch Holdings, LLC (175063)",175063,Ward,Gas turbine CC + COG,,,,natural_gas,1320,,,"CPV Basic Ranch Holdings, LLC",,,,2024-11-25,1320,"CPV Basic Ranch Holdings, LLC",,,,,,,GE,GE 7HA.03,,2024
